{
  "$schema": "https://json-schema.org/draft/2020-12/schema",
  "$id": "https://jocaagura.dev/schemas/jocaagura_domain/v1/model_group_alias.schema.json",
  "title": "ModelGroupAlias",
  "description": "Canonical JSON contract for ModelGroupAlias in jocaagura_domain.",
  "type": "object",
  "additionalProperties": false,
  "properties": {
    "id": { "type": "string" },
    "groupId": { "type": "string" },
    "aliasEmail": { "type": "string", "format": "email" },
    "status": { "type": "string", "enum": ["active", "pending", "error"] },
    "errorItemId": { "type": "string" },
    "crud": { "$ref": "./model_crud_metadata.schema.json" }
  },
  "required": ["id", "groupId", "aliasEmail", "status", "errorItemId", "crud"],
  "examples": [
    {
      "id": "alias-1",
      "groupId": "group-001",
      "aliasEmail": "soporte@domain.com",
      "status": "active",
      "errorItemId": "",
      "crud": {
        "recordId": "alias-1",
        "createdBy": "system@domain.com",
        "createdAt": "2025-01-01T10:00:00.000Z",
        "updatedBy": "system@domain.com",
        "updatedAt": "2025-01-01T10:00:00.000Z",
        "version": 1
      }
    }
  ]
}
